id|created_utc|subreddit|title|selftext|upvote_ratio|ups|downs|score
t3_1bzahku|1712612777.0|investing|Backdoor Roth conversion when I have a Rollover IRA|"I have a Rollover IRA (Fidelity) from a previous employer and I have a 401K with my current employer. I just opened and contributed to Traditional IRA on Robinhood (to get their 3% match offer) but I realized that I cannot do a backdoor Roth conversion due to the pro-rata rule. What are my options? 

  
If I rollover my rollover IRA into my existing 401k before doing BDR, do I have to wait for a minimum duration? For example, if I send my Rollover IRA money to my 401k in April of 2024, then can I do BDR this year without triggering the pro-rata rule? "|1.0|4.0|0.0|4.0
t3_1bza2ns|1712611835.0|investing|New fund that gives exposure to SpaceX and OpenAI|"It’s a fund, but behaves like a stock so far, and the movements have been wild in just 1 week. Thoughts on it? What do you think would be the factors that bring it up even more? What may bring it down? How high can it go? Would it crash anytime soon?

This is meant to be a discussion, not an advice seeking post.
"|0.1|0.0|0.0|0.0
t3_1bz9rgb|1712611130.0|investing|Passive Investing with Ally? |"I have set aside a decent chunk of money and would like to use it for passive/ long-term investing (primarily VTSAX and smaller amounts of a few aggressive ETFs like AOA). 

I already have some CDs and a HYSA at Ally, and like the user interface + convenience of instantly transferring funds  between my accounts. With Ally investing, there are no transaction fees. You are buying the same investments, same expense ratio. But I feel like I haven’t heard of anyone using Ally for investing… is there a big downside I’m not aware of? Or compelling reason it is better to always go directly with Vanguard/Fidelity/Schwab in my situation? 

"|0.5|0.0|0.0|0.0
t3_1bz5ypn|1712602403.0|investing|Would Fastly be a small-cap AI play in 2024?|"[Fastly](https://www.barrons.com/market-data/stocks/fsly?mod=article_chiclet) was raised to Overweight from Neutral at [Piper Sandler](https://www.barrons.com/market-data/stocks/pipr?mod=article_chiclet) and the price target on the stock was reduced to $16 from $19. Shares of the cloud-computing company rose 7.5% to $13.47.

Fastly, Inc. specializes in providing real-time content delivery network services, focusing on edge computing, edge delivery, edge security, and edge applications such as load balancing, image optimization, video on demand, and managed edge delivery. The company aims to optimize customer engagement and enhance digital experiences through its comprehensive suite of services. 

Despite a 30% negative operating [margin](https://www.ainvest.com/news/five-small-cap-ai-plays-to-watch-240410107fe32cf6a6d4d3ad/) and concerns over sustaining customer growth and revenue recovery, Fastly has shown improvements under new management. The company reported a 7.8% year-on-year revenue growth in the fourth quarter of 2023 and significant customer acquisition, including 31 new enterprise customers. This performance, driven by a new sales compensation structure and simplified pricing, reflects Fastly's efforts to adapt and innovate in a highly competitive market."|0.54|1.0|0.0|1.0
t3_1bz5s2o|1712601946.0|investing|What’s missing from my Vanguard basic conservative long term portfolio with VOO and VBILX? What else would you add? |"What’s missing from my Vanguard basic conservative long term portfolio? 

Besides my 401K I have:
60% VOO, 40% VBILX and 20% 1 select tech company I’m gambling on. 

What other 1 or 2 funds would you buy to spread risk and capture long term growth?

I’m tying to balance stocks with bonds. But wondering if I need to have something in foreign stocks or …? "|0.4|0.0|0.0|0.0
t3_1bz3tux|1712597249.0|investing|Why buy SGOV when money market yield is the same? |"Why buy SGOV when money market yield is the same? 

I have $50,000 in SGOV short-term bond fund and realized my money market fund is paying the exact same yield. 

What the the benefits and drawbacks of just keeping money in my market fund? If yield goes down there it will also go down in SGOV. I'm just wondering if I'm missing something totally obviosu to everyone else ... "|0.6|4.0|0.0|4.0
t3_1bz3lns|1712596722.0|investing|Can I transfer the 529 I have for my grandchild to my son, leaving the beneficiary as my grandson, to keep from it being recognized as far as FAFSA requirements?|"Title says it all. I would like to open another 529, fund it with SOME but not all of the 529 I have in place already as to not have to spend it all in two years to be sure it doesn’t fall under FAFSA guidelines. I will repeat this process maybe twice per year in order to fund my grandsons tuition, room and board, etc. My son has found himself in a difficult financial situation so I want to help my grandson as much as I can without impacting his ability to receive aid. 

Thank you!!

EDIT: including WSJ link which led me to ask.

https://www.wsj.com/articles/love-grandma-how-grandparents-can-help-pay-for-college-11548960033



"|0.47|0.0|0.0|0.0
t3_1bz381a|1712595839.0|investing|Once there are more EVs on the road than gasoline vehicles, what happens to petroleum stocks?|"Petroleum stocks are still considered solid. Especially ownership of stocks from one of the big companies that pay out solid dividends.

Once the demand for oil and gasoline drops (which is still probably 7–10 years away), what do you think will happen to these stocks (like Shell, Suncor, Exxon, BP, Chevron, and other small midcaps, etc.) 5 years from now?

Is it a good plan to slowly pull out of these stocks? In a year? 3 years? 5 years? 

Oil and gas usage will still be needed for boats, planes, homes, and other commercial applications where EV technology is still multiple decades away. But the loss of the ordinary vehicle or truck market is likely going to have a big negative impact on these companies. 

Can Shell/Exxon, for example, fill in the gap by pivoting towards EV charging pit stops? Can good profits be made as it is expected that an EV charge for 10 to 15 minutes should cost significantly less than equivalent gasoline?

If this is the pivot, what problems could arise? Would it potentialy stress out electrical grids?

"|0.54|8.0|0.0|8.0
t3_1bz2w8r|1712595070.0|investing|Vanguard Fishing Scam PSA|"https://imgur.com/a/Q1wI3Mb

Somehow when trying to log on to vanguard I ended up with this error message. The grammar and capitalization were red flags. When I called the number, someone with an Indian accent picked up immediately and asked for my full name and whether it is for an existing account. Anyone encounter this before?"|0.38|0.0|0.0|0.0
t3_1bz2g87|1712594013.0|investing|HSA or 401k? I would need to enroll in HDHP|"Looking for arguments for or against enrolling into a HDHP solely for access to HSA. The cheapest HDHP insurance premium through my employer comes out to $80 monthly, so $960 annually for insurance premiums. If I did this, I would max out the HSA at $4150 annually or whatever it is.

The alternative is to solely keep contributing to my 401k which I would max out at $23k annually.

(The reason I don't have a HDHP right now is because I actually have chosen not to have insurance at all. I am totally healthy 28 year old and pay out of pocket if I need to see a doctor for something, which in the past has really only been preventative/diagnostic expenses such as lab work and physical exams every 2 years or so. And these expenses are wayyy less than my premiums. Yeah yeah, I know, what if I do develop a health condition or have an accident or emergency.. please spare the argument, I appreciate your concern but that's not what this post is about lol)

Thank you kind redditors!


Edit: Lol everyone commenting on my choice to not have insurance anyways. Okay for the sake of my question, imagine I still have insurance with my parents. Is it worth it to enroll in HDHP anyways just to get the HSA so that I can max it out? The purpose of this post is to maximize long term investment. "|0.47|0.0|0.0|0.0
t3_1bz0k85|1712589620.0|investing|VOO vs SWPPX Roth IRA Schwab Account|"I was looking at VOO initially but searching for a mutual fund so I can use the extra cash to place in there since Schwab doesn’t allow fraction shares for ETFs. I saw SWPPX in a past post. I can purchase SWPPX initially for $1 and of course for VOO you must have at least $476. On the chart performance they look like they both follow very closely to the benchmark. 

Am I missing something as to why someone would spend more on VOO or could it just be preference of ETF vs Mutual Fund? 
"|0.55|1.0|0.0|1.0
t3_1byzxn5|1712588134.0|investing|Mutual Fund Downside Question|"Hello all,

A friend came to me mentioning something I never heard before and I wanted to get some details to see if this was true. He listened to a finance podcast and it was discussed that, according to him, when someone else sells and asks for the distribution of their mutual funds it will cause some sort of taxable implication for other shareholders because the shares within the fund are now sold and redistributed. Basically saying when someone else sells the same mutual fund you own, you will somehow incur a fee that needs to be covered which makes a mutual fund a disadvantage over an ETF (the episode was about the benefits of ETFs over mutual funds, or something like that).

This makes no sense to me and sounds like he possibly interpreted it wrong. Why would other shareholders pay a tax just because someone else decided to sell? Let me know what you think. Just want to gain some clarity on this.

Thanks

EDIT: Much appreciated for the responses so far. I found some details regarding this after doing more research and, like all have said so far, it is indeed true. Surprised I haven't found these details mentioned as much in different posts when looking at Mutual Funds vs ETFs throughout the years. I blame myself for not being thorough but glad I'm still learning more.

https://investor.vanguard.com/investor-resources-education/taxes/how-mutual-funds-etfs-are-taxed#:~:text=At%20least%20once%20a%20year,sold%20any%20of%20your%20shares.
https://fastercapital.com/content/Capital-gains-tax--Phantom-Income-and-Capital-Gains-Tax--Crucial-Insights.html#:~:text=It%20is%20also%20known%20as,until%20the%20asset%20is%20sold."|0.38|0.0|0.0|0.0
t3_1byzv23|1712587955.0|investing|Aura Health Crowdfunding |Does anybody have any thoughts on this as a crowdfunding investment? All-in-one wellness app for well-being and therapy. There was a segment this weekend on CBS Sunday mornings talking about woebot which is AI generated therapy so I started doing some research and came across this opportunity.|0.33|0.0|0.0|0.0
t3_1byzqzg|1712587682.0|investing|Dividends in retirement…reinvest or no?|"For those who are not working anymore and say, using 4% draw down from investments.
Is it better to have dividends reinvested automatically or take the dividend payments and then asses how much additional % you need to draw to meet your income goal?
I hope this question makes sense TIA
"|0.4|0.0|0.0|0.0
t3_1byyxyg|1712585660.0|investing|Roth IRA - Investing in S&amp;P 500|"I have a Fidelity Roth IRA, and shamefully have parked a bit of money to invest in the last couple of years. I am looking to invest now and into their Index Fund, FXAIX (S&amp;P 500). However, I have a few concerns and questions:
 
1) Is there anything else to add along with FXAIX? Like, is it important to be as diversified in my retirement portfolio? My goal is to keep it simple to focus on capital gains/total returns from one fund. But, if there’s suggestions to make it a 2-fund or 3-fund portfolio, I’ll have a listen to suggestions as well as handle my due diligence.

2) Since Roth IRA is a tax-advantaged account (After-tax dollar grow tax free), are dividend ETF funds something I should consider? Or look into dividends in general if I want to generate cash flow later in my retirement?
 
2) Would lump-sum investing or DCAing investing be ideal? For the sake of example, Iets say I have $20k parked in my Roth IRA right now. Despite the market conditions right now, I’ll invest the whole $20k (lump-sum) into FXAIX sometime this month, and then make the full contribution to my Roth IRA for 2024 ($7k max contribution limit) around the same time next year (April 2025). So, on an annual basis. Is that a good strategy?
 
All suggestions and insight on this is highly appreciated. Thank you!"|0.62|3.0|0.0|3.0
t3_1byybdt|1712584069.0|investing|Premarket Trading w/ Vanguard|"Hey everyone,  


Novice investor here.  Been using Vanguard to buy mutual funds for years but just started trading individual stocks on it.  Have a question I'm curious anyone knows the answer to:  


Spent the weekend researching good stock picks and found 2 that looked promising.  I signed into my Vanguard account and placed a buy order on each.  I was quoted the close price for Friday but of course there is a disclaimer that it's an estimate.  Monday morning comes around and the orders execute at the open price, which is significantly (to me) higher than the close price on Friday.  


After doing some research it looks like the stocks were driven up in the pre-market.  Looking thru Vanguard's website I see how you can execute trades in the after-hours session but couldn't find anything for pre-market.  Does anyone know if Vanguard has the ability to trade pre-market?"|0.38|0.0|0.0|0.0
t3_1byy7f4|1712583775.0|investing|Is smart money concepts a SCAM?|"I've been pondering a common theme among traders on YouTube lately, where roughly 80 percent seem to rely heavily on patterns, trend lines, and indicators, while the remaining faction identifies as ""smart money traders,"" claiming to emulate the strategies of institutional players like banks. It's intriguing yet confusing, as both camps often criticize each other's approaches.  
What are your thoughts on this? I'm genuinely curious to hear different perspectives and insights from the community."|0.33|0.0|0.0|0.0
t3_1bywky3|1712579212.0|investing|Is country risk premium necessary? |If countries have risks that are unsystematic (not correlated with the world markets), they can be diversifiable and should not be included in the cost of capital. What do you think about that? Maybe we can include the part that cannot be diversifiable, which is actually the world market risk (isn't it ERP?). |0.5|0.0|0.0|0.0
t3_1bywh91|1712578897.0|investing|Diversifiable &amp; Non-Diversifiable Risk|"

Hey everyone,

Just a quick question that I couldn't tackle it for a few days. 

As you know, the only risk that is relevant for purposes of estimating a cost of equity is market or ""risk that cannot be diversified away."" In that sense, a company-specific risk, in my opinion, can easily be diversified away. 

Here's my question: if any risk that can be diversified away should not be considered as an additional risk premium, shouldn't we use a similar cost of capital when valuing Apple and a new-born startup? Because, startup has a company-specific risk like unforeseeable cash flows, but it is something non-systematic and can be diversified away. Right? 

We of course don't use the same cost of capital because the startup is a riskier asset, but what I don't understand here, if we don't consider any additional risk premium for risks that can be diversified away, why don't we use a similar cost of capital for a startup with Apple, Amazon, etc..."|0.25|0.0|0.0|0.0
t3_1byvwnj|1712577100.0|investing|Moving From Mutual Funds to ETFs|"This week, I am planning to sell all of my mutual funds in my ROTH IRA that I have been buying since 2010. These are all low cost index type mutual funds that have been bought and held. 


Next week, I am planning to transfer all the proceed cash into Robinhood and re-purchase low cost index ETFs. My required distribution date for my Roth IRA is in roughly 30 years. 



What am I missing when selling all my mutual funds and re-purchasing similar ETFs?


------------------

TLDR - Selling all my low-cost index mutual funds for low-cost ETFs in my ROTH IRA. Am I missing something here?"|0.44|0.0|0.0|0.0
t3_1byvvox|1712577019.0|investing|Mutual fund soft-close, worth staying invested?|"There is a mid cap mutual fund that had a soft close due to AUM being too large relative to the mandate size.

Is there any reason to stay invested in the fund, or should the assets be reallocated to a different fund?

My guess is they can still manage the fund effectively but just had to prevent additional AUM from coming in otherwise their trades could have market impacts, but open to your thoughts!"|0.57|1.0|0.0|1.0
t3_1byvukw|1712576920.0|investing|How to use FFOs for an REIT dcf|Currently looking into data centers REITs like IronMountain, Digital Realty, and Equinix. But their capex spending is really intense and the traditional NOPAT methodology doesn’t really work. Can someone explain how to use FFOs and why they are preferable? I heard a lot about this metric being preferable for REIT valuation. If anyone has an excel template for this would be great as well, thanks|0.56|1.0|0.0|1.0
t3_1byt92k|1712567195.0|investing|How do you choose ETF to buy? Which factors you compare?|"So I've been looking to start investing into some form of world ETF. However I kind of ran to the issue that even when filtering for all of the possible things I can think of (listed below). I still come up with multiple seemingly good options.

I'm struggling to separate them and decide between each other.

Variables I've been filtering for:

* Accumulating distribution
* Domiciled in EU
* Replication of Sampling or Full replication
* Fund size of over 500M

Here are list of some the funds I've looked at:

[https://docs.google.com/spreadsheets/d/19dObxIu-c0jMkDEooRTznCfZGT7NJ0RNLH7MCF3D\_Pw/edit?usp=sharing](https://docs.google.com/spreadsheets/d/19dObxIu-c0jMkDEooRTznCfZGT7NJ0RNLH7MCF3D_Pw/edit?usp=sharing)

&amp;#x200B;

Some questions I have:

* How important or useful is fund size after certain point? I mean iShares Core MSCIE world has by far the biggest fund of any of them, should I factor this in in some way?
* What justifies some funds having higher TER's? What would be downsides or risks going with something like SPDR MSCI World UCITS ETF that has 0.12 TER?
* How would you view ETF's age? Like is there particular upside or downside to something like Vanguard FTSE all-world UCITS ETF that seems to be less than 5 years old?
* Would you view total holdings as important or is this a case of where 1400+ vs 3000+ companies doesn't really matter as in either case it would be plenty diversified?

Overall I'd just like to hear some views about which things people use to differentiate somewhat similar ETF's and make the decision to which one you buy. One difference I can understand between these examples is the country/sector splits differing slightly, but I'm struggling to understand which of the other factors I asked about above I should consider and how much."|0.63|4.0|0.0|4.0
t3_1byt64l|1712566868.0|investing|Daily General Discussion and Advice Thread - April 08, 2024|"Have a general question?  Want to offer some commentary on markets?  Maybe you would just like to throw out a neat fact that doesn't warrant a self post?  Feel free to post here! 

If your question is ""I have $10,000, what do I do?"" or other ""advice for my personal situation"" questions, you should include relevant information, such as the following:

* How old are you? What country do you live in?  
* Are you employed/making income? How much?  
* What are your objectives with this money? (Buy a house? Retirement savings?)  
* What is your time horizon? Do you need this money next month? Next 20yrs?  
* What is your risk tolerance? (Do you mind risking it at blackjack or do you need to know its 100% safe?)  
* What are you current holdings? (Do you already have exposure to specific funds and sectors? Any other assets?)  
* Any big debts (include interest rate) or expenses?  
* And any other relevant financial information will be useful to give you a proper answer.  

Please consider consulting our FAQ first - https://www.reddit.com/r/investing/wiki/faq
And our [side bar](https://www.reddit.com/r/investing/about/sidebar) also has useful resources.  

If you are new to investing - please refer to Wiki - [Getting Started](https://www.reddit.com/r/investing/wiki/index/gettingstarted/)

The reading list in the wiki has a list of books ranging from light reading to advanced topics depending on your knowledge level. Link here - [Reading List](https://www.reddit.com/r/investing/wiki/readinglist)

Check the resources in the sidebar.

Be aware that these answers are just opinions of Redditors and should be used as a starting point for your research. You should strongly consider seeing a registered investment adviser if you need professional support before making any financial decisions!"|0.68|3.0|0.0|3.0
t3_1byrepp|1712559568.0|investing|Is the quarterly tax due on Apr 15 my previous yearly tax bill divided by four?|"Think the penalty is bigger this year because of the federal reserve movement in interest rates.  And I hope my tax bill for last year includes the quarterly tax bill that's due the same day but I highly doubt that!!

I don't think I have enough money to pay everything since I put most of it in a 401k"|0.33|0.0|0.0|0.0
t3_1byr2zt|1712558243.0|investing|Brokered CD rate qeustion?|"I'm considering purchasing a brokered CD, but there seem to be a lot of variables that have me confused.

Am I understanding this correctly.  I'm seeing the highest brokered CD's at around 5.5% and for a sale price of $100.00.  Then I see some that offer more like 4.85%, but the price is only $92.50.

So if I purchase the minimum quantity of say 50, the cost would be 5x $925= $4625, but my deposit amount would be $5,000, and I would earn 4.85% until coupon maturity date?  If so, that seems like a no-brainer, to purchase the lower priced CD's with slightly lower yields.

In this example, the maturity date would be 2 years away, so that would earn almost 10% interest in 2 years + the $375 discount, which would be in the 8-9% APY range when factoring in the discount on the CD.  8-9% return guaranteed with FDIC insurance?  How is that possible, I must be missing something."|0.43|0.0|0.0|0.0
t3_1byqhm8|1712555953.0|investing|Thoughts on rolling over old 401K to Robinhood for the 3% promo?|"RH is offering a 3% match for the roll over, however, there are funds designated at different horizons and also government funds in my old account that are not available in RH. Is this a good ideas to move them to RH in place of ETFs/stocks? Also any recommended ETFs that may be good replacements for these funds if the move does take place?
"|0.44|0.0|0.0|0.0
t3_1bypfle|1712552128.0|investing|Wealthfront HYSA vs Titanvest Smart Cash?|"I have 30k in Wealthfront with 5% APY, and thought it is one of the highest HYSA but saw an ad for Titanvest Smart Cash which has 5.27% APY and on top of that better after tax earning.

The calculation on titanvest website shows I will be saving $200 more on Titanvest. How is this possible? I make 48k a year in California, will it make much of a difference for me?

Thanks!"|0.5|0.0|0.0|0.0
t3_1byp0cv|1712550680.0|investing|Did anyone used to ise stockmarketeye? What do you use now?|I really miss the reporting from stockmarketeye, being able to really see what was happening with variois accounts or all holdings. Does anyone have a recommendation for something fairly simple like that? I don't seem to be able to get a clear view of everything...|0.71|3.0|0.0|3.0
t3_1bynoga|1712546452.0|investing|Do you think Warren Buffet bet on SiriusXM has legs?|"&gt;February 2024 - Berkshire Hathaway Purchased $167 Million Worth of SiriusXM. 

Does he know something the public doesn't? Like a proprietary tech coming soon?

Does he plan to attend SiriusXM shareholder meeting and help steer the ship in the right direction? (Possible?)

Right now the king of music stream service is Spotify with a whopping 602m users and SiriusXM a long distance 2nd with 39m users. I'm sure music creators wouldn't mind another legit option to make money. Or have another music stream competitor help drive up earnings. 

What is he betting on?

"|0.81|92.0|0.0|92.0
