id|created_utc|subreddit|title|selftext|upvote_ratio|ups|downs|score
t3_1bl9hxu|1711139927.0|investing|living in a taxfree country, high yield dividend stocks or growth stocks?|"im 33 years old and i live in Qatar and we don't pay taxes here, so even when i cash out my whole investment portfolio i don't pay any taxes, but there is 30% taxes on dividend that gets automatically deducted as far as i know.  
so i should focus on growth stocks and don't give much attention to dividends? or am i missing a lot?"|0.5|0.0|0.0|0.0
t3_1bl97ym|1711139251.0|investing|"brokers that have 1:100 leverage for stock cfds
"|hey i was wondering if you guys know about any brokers like FBS that has 1:100 leverage for stock cfds. any input is very appreciated, FBS cant be yhe only ones im certain but no matter how much i have searched for one i cant seem to find such a broker.|0.5|0.0|0.0|0.0
t3_1bl77wa|1711134298.0|investing|HELP! Unsure how this Annuity works.|"Can I get help understanding this annuity with the specific rider's attached? GMIB and GMDB, in terms of starting to withdrawal and what happens at death. This non qualified annuity was purchased in 2012 for $100,000.  I understand it is a terrible investment, but the family member is 63 now, I'm not sure if cashing it in now and putting it into low expense ratio index funds is worth it at their age.  It is beyond the surrender date so there is no fee for that but I believe there would be ordinary income tax as well as fee's for the riders.

The annuity has not been withdrawn yet, any help would be appreciated!  
https://imgur.com/a/vOEedwn  


&amp;#x200B;

&amp;#x200B;"|0.57|1.0|0.0|1.0
t3_1bl5y1e|1711131182.0|investing|What Cost Basis Method Is Best When Selling?|I have a small investment in different stocks and I want to sell a couple of them to purchase something better.  I have Schwab and it mentioned that I should choose the best Cost Basis Method for my specific circumstances vs taking the default.  I don’t recall seeing that when it was TD Ameritrade.  For tax purposes is there a big difference between the different options?|0.6|1.0|0.0|1.0
t3_1bl5ltq|1711130348.0|investing|Old AAPL stock.. buy, sell, hold?|"I have a large amount of AAPL stock I purchased around 2009.  I'll leave the amount out as I believe it's irrelevant to the conversation.  Have held it all the way through the split.

I have a very busy professional life, I look at my stocks maybe once a week at most, so I wouldn't consider myself a big trader by any means.  My other stock ""dealings"" currently are my 401k and a mutual fund I put money into monthly on a set and forget basis. I do have a dozen or so other stocks that range in success.  Losers and winners.

Regarding AAPL, bearing in mind I'm not an active trader, should I just forget about it?  Let it ride and hope it continues to trend upward? (I am fine with this approach).  Or, should I cash out and put the money into something else? I don't need this money for anything nor do I have any plans for it.  Looking forward to hearing some opinions.  Thank you"|0.58|6.0|0.0|6.0
t3_1bl4y7d|1711128681.0|investing|What can I do if my bank doesn't provide Roth IRA's?|"If my bank only provides traditional or Simple IRA's (for small businesses or employees) but not Roth IRA's, is it still worth making an IRA account? They do provide CD's but I think an IRA would be most beneficial for long term investing. 

Should I open a vanguard account and just make a Roth IRA there rather than through my bank? "|0.13|0.0|0.0|0.0
t3_1bl3ygv|1711126260.0|investing|What combination of ETFs would you invest in for long term returns? |"I’m currently invested in VUSA and am thinking of investing in some more ETFS, to do an ETF only portfolio for long term investments. I’d likely put £250 into it each month.

So if you were making an ETF portfolio for long term returns, what would you do?"|0.33|0.0|0.0|0.0
t3_1bl3gy4|1711125050.0|investing|Samsara $IOT is an excellent company with terrific growth prospects, but too expensive at this price.|"Samsara $36 (IOT)

* The promise of fleet expansion and other business benefiting from AI/LLM’s more computing power should help the best IoT in the business. 
* It is a pure play with several large competitors like Microsoft and Google.
* Strong momentum with large customers; Customers  &gt;100K grew 49%, while customers over $1Mn in ARR grew 61%.
* FY 2025 revenue growth should be 29-30%, with ARR in the mid thirties.
* Adjusted operating profit margins are still very low at 2% and cash flow margin was just 6%, so it has a long way to go.
* Samsara is valued at 15x sales with a three year growth forecast of 28% - thats a bit too rich for me. 

I own some but will add only around $30.

Holding for now.  
"|0.5|0.0|0.0|0.0
t3_1bl27tn|1711121913.0|investing|Schwab Roth IRA Portfolio Check |"I have had my Schwab Roth IRA account for over 8 years. I wanted advice on if the Schwab performance checkup for how close you are to the chosen portfolio is something I should be following. I am 36 years old. 

My portfolio is following Schwab’s Target Asset Allocation: Total Return Aggressive with Munis. I am invested in a total of 14 funds ( AVDV, DBA, OILK, OUSM, REET, SCHB, SCHH, SCMB, SNPE, SPEM, SWTSX, VSGX, VTI, VXUS, Cash) Gain/Loss +$475.26 10.73%. I feel like I have a lot of funds and a lot of cash ($316.40) just sitting there but I believe that’s what being diverse means in investments (you don’t want all your funds in one basket). 

I know you all are experienced and I need advice if I should trim down the number of funds or if you all (who are at Schwab) follow there performance guides for what funds to invest in. "|0.4|0.0|0.0|0.0
t3_1bl26os|1711121830.0|investing|"What are some ""Dean"" Related Stocks for a Birthday Gift?"|"My Godson is named Dean and I wanted to buy him a little Dean themed fund, mostly as a joke but hopefully a nice little present when he turns 16 or whatever. Do you have any ideas for companies that might fit the bill?

All I'd thought of so far was Jimmy Dean and Dean Dairy. Thanks for the help"|0.4|0.0|0.0|0.0
t3_1bl1lpw|1711120346.0|investing|Is it worth having wealth management firm manage funds?|"hello,  
  
Is it worth having wealth management firm manage funds? I'm on W2 and have saved over the years and invested \~500k in stocks. I don't track stocks every day and I have around 20% loss. Recently I got a call from a reputed wealth management firm that they can manage funds etc.   
  
They want to consolidate funds from all my brokerage funds and transfer to their bank, so that they can start with clean slate. Problem is, I have to harvest 60-80k in loss this year. They claim any profit generated in future can wash off the loss. They showed their funds returning 20% or so every year... but again past performance doesn't guarantee future performance. I'm not really convinced,    
  
Is it worth having wealth management firm manage funds actively? or should I stick with something like index funds? Any thoughts? "|0.46|0.0|0.0|0.0
t3_1bl0zl1|1711118763.0|investing|is position trading for forex a form of investing?|"Position trading is the longest-term trading and can have trades that last for several months to several years! Position traders ignore short-term price movements in favor of pinpointing and profiting from longer-term trends. It is this type of trading that most closely resembles “investing”.

is it considered more safe than swing trading."|0.23|0.0|0.0|0.0
t3_1bl0yy1|1711118722.0|investing|Made Post-Tax contributions to a Simple IRA, now what?|Hello all, long story short, I've been contributing post-tax dollars to an employer sponsored Simple IRA, thinking it was a Roth Simple IRA. After speaking with the institution, I believe it's a regular Simple IRA, and I am not worried that my money will be double taxed (taxed before going in, taxed when I retire and withdraw). Can a Simple IRA be converted to a Roth? If I can show the IRS that the contributions were made post tax, will they still seek tax when I withdraw? Any ideas or advice to rectify this?|0.5|0.0|0.0|0.0
t3_1bl0wz2|1711118576.0|investing|Trade Desk (TTD) is worth buying on declines|"**Positives**   


* Trade Desk $TTD is growing revenues at 22-23% and should do so for the next 3-5 years.
* Cash Flow generation is excellent with margins of 30% because of the massive SBC as is adjusted operating income.
* It is the largest DSP (Demand Side Platform) for the Ad-tech industry by a mile and pretty much partners with everybody in the industry, with strong footholds in all the segments.
* Advertising for the 2024 election should give it decent tailwind.
* Connected or Smart TV's should be a strong growth catalyst.
* Advertisers will look for other solutions since cookies are getting deprecated and Trade Desk should be a major solution provider.  


**Negatives**  
Valuation risk at 16x sales, no GAAP profitability and unlikely for a while given the SBC, which will keep a lid on the multiple.

I've started buying around $84 and will keep adding on declines.  
"|0.69|5.0|0.0|5.0
t3_1bl0vxz|1711118499.0|investing|what do you think of swing trading ( the least risky ones)?|In the short term, swing trade investors may see larger profits than those using long-term time frames. At the rapid rate, investors buy and sell their stock, swing trades generate profits quicker, and long-term investment professionals wait weeks or even months before the stock is sold and generate a profit.|0.33|0.0|0.0|0.0
t3_1bl08do|1711116803.0|investing|Am I missing something with Reddit?|"Everyone here seems to be reeing over the ceo and coo making a combined $300 million while posting a $90 million loss in 2023… but do the math if you take out those two salaries they are already profitable. I feel like it is extremely normal for founders and key players to get compensated by a lot of shares, but now that they are public, in 2024 they will take a much more reasonable salary, and continue on raising the value. 

With how much I use this app I have to be bullish lol. Everything I ever end up buying I do vast research on reddit, and I know I’m not alone on that. Once they figure out how to monetize that, reddits value will grow."|0.22|0.0|0.0|0.0
t3_1bl05f7|1711116592.0|investing|Artificial intelIigence ETF|"Hi! What do you guys think about artificial intelligence ETFs such as :

- wisdomtree artificial intelligence
- xtrackers artificial intelligence and big data

They seem like the most solid ones to invest in.

I already have parts in GAFAMs which are likely to be big actors in AI.
I am looking for a more general stock to invest in AI.

What do you guys think? Should I go for these two or do you have any valuable recommendations I should be taking into considerations? 

Thanks for reading 

Regards"|0.14|0.0|0.0|0.0
t3_1bkzpjo|1711115418.0|investing|HSA CD investments versus bank cd investments |"I have an HSA account. I put 10k in an HSA brokerage cd at 4.6 % . 
I have bank CDs, around 5% interest +/-. 
The bank CDs make a lot more money than the brokerage CD. 
Why is this? 
How should I invest HSA funds? 
I do make to deposit full allowable amount in my HSA each year. 
Thank you "|0.5|0.0|0.0|0.0
t3_1bkz8xs|1711114144.0|investing|What percent do you hold of EX-US (international) equities in your portfolio?|"After diving into various books, posts, and threads, it's clear that there's a consensus on the importance of including international stocks in your investment portfolio. However, the question remains: what portion should you allocate to them?  
  
I've come across a range of suggestions, from 10% to 30%, with some advocating for even higher percentages. For those who opt for a ""buy VT and chill"" approach, they might find themselves already heavily weighted towards international stocks, with VT representing almost 40% international exposure.  
  
While it's true that the US market has outperformed the international market in recent years, it's essential to remember that past performance is not indicative of future results.  
  
In my brokerage account, I currently hold approximately 15% of my portfolio in ex-US stocks, while in my 401K, I've allocated about 20%. Interestingly, my wife has taken a more aggressive stance in her 401K, with international stocks comprising closer to 30% of her portfolio.  
  
I'm genuinely interested in hearing where everyone else stands on this issue. What portion, if any, of your portfolio do you allocate to international stocks?"|0.76|22.0|0.0|22.0
t3_1bkz8k1|1711114109.0|investing|Other options besides M1 investing outlet? |"Hello! 
Like the title says… I am looking to expand to other alternatives besides M1 investing site. Nothing against them as the experience has been good to me for the past 3 years or so. 

Looking for suggestions from the community that are similar to M1 investing outlet. What do you use at this current time? Would like recommendations that have an app as I do a lot of transactions via my iPhone when traveling. 

Thank you for the suggestions 🤙"|0.5|0.0|0.0|0.0
t3_1bkwnc9|1711105644.0|investing|Good or bad idea to buy tsla stocks?|I'm new to investment and stocks in general and I'm wondering if it's a good idea to get some tsla stocks, i know i missed the train in 2020 but there is always new trains happenings. Also i want to know are news from other elon musk corelate with tsla stock like any Twitter news or neuralink discoveries? Or it's only tsla news related?|0.28|0.0|0.0|0.0
t3_1bkvx5h|1711102865.0|investing|I got overconfident, and lost it all|"I am writing this mostly as a lesson to myself, the loss was little more than a mere couple of months of salary but it does sting quite a bit.


My strategy in general was supposedly to put most my money into ETFs, those always will come to a return in the long run but the last couple of months I gambled, certain stocks and commodities are going at record highs and I bite, hedging my funds on them. At first I am getting ungodly amount of returns and I ma hooked, forgetting the fundamentals, what goes up, will eventually have to come down, I locked my profits, feeeling happy, then greed, read a few news articles and said to myself ""hey, I got deep pockets, and these has returned very well! even if they dip a bit, they will eventually have to bounce back up!"" and went in without setting a stop loss, ah the euphoria of a constant win. 

Oh how wrong I was, always remember to stick to a strategy, always remember that there is a risk of loss, I lost all the profits I made in a month, along with a couple months worth of salary I threw in the market.


It stings but it is what it is... In shame I cannot confide these with people I know in real life, so all I can do is to anonymously vent somewhere online. "|0.83|152.0|0.0|152.0
t3_1bkvg7d|1711100980.0|investing|Revolut vs IBKR long-term|"I recently found out that revolut switched to the usage of omnibus account which means I don’t actually fully own my shares.

As for IBKR, AFAIK I’m the direct owner of the shares.

So, let’s say I’m planning to buy stocks regularly for 10 years, would it be safe to use revolut for that considering I have lower fees there? What if it bancrupts, do I lose my shares as I’m a part of the omnibus account or shares would be re-registered?

Ok, I know that revolut is using “DriveWealth”, but then what if “DriveWealth” bancrupts?"|0.77|5.0|0.0|5.0
t3_1bkus0i|1711098071.0|investing|Daily General Discussion and Advice Thread - March 22, 2024|"Have a general question?  Want to offer some commentary on markets?  Maybe you would just like to throw out a neat fact that doesn't warrant a self post?  Feel free to post here! 

If your question is ""I have $10,000, what do I do?"" or other ""advice for my personal situation"" questions, you should include relevant information, such as the following:

* How old are you? What country do you live in?  
* Are you employed/making income? How much?  
* What are your objectives with this money? (Buy a house? Retirement savings?)  
* What is your time horizon? Do you need this money next month? Next 20yrs?  
* What is your risk tolerance? (Do you mind risking it at blackjack or do you need to know its 100% safe?)  
* What are you current holdings? (Do you already have exposure to specific funds and sectors? Any other assets?)  
* Any big debts (include interest rate) or expenses?  
* And any other relevant financial information will be useful to give you a proper answer.  

Please consider consulting our FAQ first - https://www.reddit.com/r/investing/wiki/faq
And our [side bar](https://www.reddit.com/r/investing/about/sidebar) also has useful resources.  

If you are new to investing - please refer to Wiki - [Getting Started](https://www.reddit.com/r/investing/wiki/index/gettingstarted/)

The reading list in the wiki has a list of books ranging from light reading to advanced topics depending on your knowledge level. Link here - [Reading List](https://www.reddit.com/r/investing/wiki/readinglist)

Check the resources in the sidebar.

Be aware that these answers are just opinions of Redditors and should be used as a starting point for your research. You should strongly consider seeing a registered investment adviser if you need professional support before making any financial decisions!"|1.0|7.0|0.0|7.0
t3_1bkul8l|1711097228.0|investing|"Where can I learn more how people are running things when they start individual companies with company names such as ""&lt;First or Last Name&gt; Capital Investments""?"|"I follow a lot of people on X who I really admire their stock analysis as I hear them on X spaces. They are amateurs and not professionals who are managing ETFs or some sort of huge wealth management portfolio. I see of them offer a subscription to their portfolio through Discord.  I don't subscribe but I do see their X posts on what they think of any particular growth stock. It seems that they are doing full time investment, but I wouldn't call it simple speculative trading or day trading. They often have their own company and seem very astute and incorporate their efforts. For example, if a guy is named Person123, he has ""Person123 Capital"" and it appears to be just a one man company.

***What are some good resources (a good book detailing their fool journey for example) to learn what people are doing in such endeavors?***

Evaluating business/stock is one of my fun hobbies. I am a conservative and cautious investor (no yolos). I love stock investment, company strategy evaluation write-ups, corporate balance sheet analysis, options trading, real estate investment, doing write-ups evaluating companies, etc.  I would LOVE to take a 1-2 year hiatus from corporate America and try doing something like this full time at some point for a year or two and make it into a formal company. I know some individuals are full-time in managing their own portfolio (i.e ""family office""), and some are full time day traders. However, I am not looking for this. I want to start something and kind of just see where it can go while perfectly understanding it's all a very competitive space.  If nothing, it can be on my resume as I started an investment company."|0.44|0.0|0.0|0.0
t3_1bkrwkm|1711085523.0|investing|Emergency Funds. Best investment accounts |It’s generally assumed that an emergency fund should contain 3-6 months of expenses if something were to happen. My current money market savings account offers shit interest rates. I’m curious on some of the best options for investments that offer high liquidity? |0.5|0.0|0.0|0.0
t3_1bkrljw|1711084308.0|investing|Has a drop in US interest rates already been priced in? In general how do you know if something has been priced in?|"Iirc a few days ago BOJ increased interest rates. Contrary to what I thought the JPY went down, apparently people had already priced this in.

It makes me think about what I can expect to happen if JPow finally does decrease interest rates. I would think the stock market would go up, but what if it's all already priced in? How do we know (if we can even know)?

And I guess this applies to other things too."|0.58|4.0|0.0|4.0
t3_1bkr7y1|1711082873.0|investing|Let’s do some very basic math on the Reddit stock.|"The market cap is currently at $8B.

There are 73M users.

Half of them are active.

Half of that aren’t bots.

Best case scenario each account represents $109 each.

Realistically that’s $400 an account.

So let me ask you: do you think your account is worth $109 to $400 ?

Puts open on Monday.

Have a great weekend."|0.78|627.0|0.0|627.0
t3_1bkqrw3|1711081273.0|investing|Retirement account with pension?|"I am currently a public school teacher in California. I make monthly contributions into our STRS account. I plan to retire as a teacher with about 40 years of service.

Is it worth it for me to have a 403(b)? I currently have a 403(b), but the investing options are limited. I would like to have more options using a traditional IRA."|0.63|2.0|0.0|2.0
t3_1bkphxm|1711077056.0|investing|Best ONE investment best for low earners?|I am a relatively low earner and I am not sure I will be able to swing maximum contributions to my IRA every year. Is it better to invest in only one such as 500 Index fund than dividing it up between that and say a mid cap? Ive been told to do like an 80/20 but in my situation it seems an all in on a large cap makes more sense. My thought is the more money you can hold in one long term the better overall. Can I assume this to be the best logic? |0.59|4.0|0.0|4.0
t3_1bkofrq|1711073799.0|investing|Accidentally over contributed to Roth 401k last year|"I changed jobs on the second day of 2023 and the bonus from my first job resulted in a $750 deposit into my Roth 401k. Approximately $400 was my contribution and $350 from the employer match.

In my second job, I put in $22,500 so I’m over by $750.

My current job said it’s too late to withdraw, but the first company said I still can withdraw the excess. If I withdraw the excess from the first company’s contribution, would I lose that $350 they contributed? 

If so, would it be better to do nothing? Would that just result in the $750 getting taxed this year and next year? Which could be maybe $175 and $175 (or the same amount as the loss)?"|0.79|65.0|0.0|65.0
t3_1bkod4y|1711073579.0|investing|Found old (1941) Income Note — Help |"As the title says, I found an income note(?) in an old folder my grandpa left with my mother before passing 5 years ago. I cannot find anything on what this income note is, or the company it’s for. Assuming it’s a worthless piece of paper, but figured I should do a little more due diligence. Photo of the note — https://imgur.com/a/Iy9Cllj

Thanks for any insight!! "|0.5|0.0|0.0|0.0
t3_1bkn3kt|1711069833.0|investing|Why do people dislike SOFI so much?|"I really like the management, the company’s response to consumer complaints, the idea of online only banking

The stock is down 28.5% all time (went public December 2020), down ~23% YTD, but up 33% in the past year. Being a relatively new public company, centered around bringing tech to banking (in a world with a future in tech) I would like to think they’ll be a big financial player in the future.

Despite everything I see, nobody seems to like the stock. I was curious as to why people aren’t liking it?

To me it seems like a no brainer for a  long term play (not to mention their interest rates are nice too)

"|0.76|79.0|0.0|79.0
t3_1bkkwtx|1711063752.0|investing|How Does My Portfolio Plan Sound?|"To preface I am 22 years old and about to graduate from college and start my career. Also, my risk tolerance is reasonably high. Currently my plan is to split my brokerage and Roth IRA accounts as follows:  
  
Brokerage - 50% VOO, 25% QQQM, 25% SCHD  
  
Roth IRA - 60% FZROX, 30% FZILX, 10% FXNAX  
  
Should I make any changes to the weightings, or add new stuff altogether?"|0.4|0.0|0.0|0.0
t3_1bkk750|1711061883.0|investing|What to do with brokerage fund with high expense ratio mutual funds? |"Hi everyone I’m looking for some advice. I inherited a brokerage account with high expense ratio funds and I started liquidating them and throwing the money into a Roth IRA to reinvest in zero cost funds, but I’m wondering if it’s smarter to exchange them? Here are the ones I have:

AGTHX
AIVSX
ANWPX
GE
GEHC
IGAAX"|0.4|0.0|0.0|0.0
t3_1bkh9pq|1711054681.0|investing|Question about Roth IRA be taxable brokerage. |I am 31 and have a few investment accounts. I’m still in student debt and have plans to pay it off. I have about 13k in my Roth IRA and can still contribute 6k towards it this year. I have a taxable brokerage from a while ago with 3k. I already filed my tax return. Should I just pull all the $ out of taxable brokerage and put into my Roth IRA if I don’t need the money in short term? Or just leave it and fuggetaboutit?|0.57|1.0|0.0|1.0
t3_1bkh3fs|1711054270.0|investing|Maxed out Roth IRA for the year. Next steps?|Hey all. Just maxed out my Roth IRA limit for the year and have some extra cash laying around. What would be the best thing to invest in? My Roth IRA is 100% VOO. I was thinking something more risky(I have no clue what that would be) Maybe some individual stock, maybe ETFs, maybe crypto? I would do this in a regular brokerage account ofc because IRA is maxed out. Any advice would be greatly appreciated!|0.5|0.0|0.0|0.0
