id|created_utc|subreddit|title|selftext|upvote_ratio|ups|downs|score
t3_1bffne0|1710514000.0|investing|China Urges EV Makers to Buy Local Chips as US Clash Deepens|"What implications do you think will this have for US and EU semiconductor manufacturers? Any insights how much substitution Chinese chipmakers can actually realistically achieve? (I was under the impression they wouldn't be able to but perhaps things have changed).

**China Urges EV Makers to Buy Local Chips as US Clash Deepens**

- *Directive could hurt Nvidia, NXP and other EV chip suppliers*
- *Order is a response to US efforts to curb Chinese chip tech*

The Chinese government has quietly asked electric-vehicle makers from BYD Co. to Geely Automobile Holdings Ltd. to sharply increase their purchases from local auto chipmakers, part of a campaign to reduce reliance on Western imports and boost China’s domestic semiconductor industry.

The Ministry of Industry and Information Technology asked carmakers this year to expand their buying of homegrown components to accelerate the adoption of Chinese chips, according to people familiar with the matter. The country’s tech overseer previously set an informal target for automakers to source a fifth their chips locally by 2025, but has grown dissatisfied with the pace of progress, the people said.

The ministry is now directly instructing firms to avoid foreign semiconductors if at all possible, said the people, who asked to remain anonymous discussing sensitive information. That means overseas chip firms effectively have to manufacture their silicon through a local foundry such as Semiconductor Manufacturing International Corp. or Hua Hong Semiconductor Ltd., one of the people said. During a recent tender conducted by a major domestic brand, one foreign bidder failed to secure a contract despite offering a price they estimated was 30% lower than the eventual winner, another person said.

The developments reflect Beijing’s stepped-up efforts to galvanize its own tech sector, a response to US attempts to curtail Chinese chip development via sanctions and restrictions on the sale of advanced technology. The Chinese directive on cars casts uncertainty over the business of companies from Nvidia Corp. and NXP Semiconductor NV to Renesas Electronics Corp. and Texas Instruments Inc., which compete with local firms to supply the world’s largest EV market.

Shares in European chipmakers that supply Chinese EV firms fell in early European trading. Infineon Technologies AG slid as much as 4.8%, while STMicroelectronics NV slid 2.2%.

Many local brands buy a hodge-podge of other components from power management chips to microcontrollers and display ICs. Some carmakers from leader BYD to upstarts like Nio Inc. rely on Nvidia processors for instance to coordinate functions in their hyper-connected cars.

The MIIT didn’t respond to a faxed request for comment. BYD, Nio and Geely representatives didn’t respond to requests for comment.

Beijing is increasingly intent on supporting a domestic chip industry it knows is lagging well behind foreign rivals, but critical to supporting the economy and maintaining a geopolitical advantage. The directive is in line with pledges this year to mobilize all means at its disposal to wrest technological supremacy from the US and other nations.

The central government may also be bracing for curbs in the auto sector specifically.

Washington is probing potential data and cyber-security risks posed by internet-connected cars from China, including EVs. US Commerce Secretary Gina Raimondo has expressed concern that data collected by the cars could wind up in Beijing’s hands, and is overseeing an investigation that could result in restrictions on the sale of those cars in the US — measures that would go beyond a potential increase in tariffs.

A mandate in favor of Chinese chips also raises the prospect of further retaliation as Washington ramps up its containment campaign.

At the Two Sessions meeting of lawmakers this month, Beijing hammered home a longstanding goal to break an American stranglehold on key spheres. Under Xi Jinping’s watch, China has expanded state control of strategically critical areas from semiconductor manufacturing to quantum computing.

Against that backdrop, Beijing has endorsed the efforts of local champions such as Huawei Technologies Co. through subsidies and targeted policies. It’s now establishing a $27 billion-plus fund to drive chip investments and hiking spending on nationwide research to more than $51 billion.

China’s biggest auto chip and software providers include Huawei, Loongson Technology Corp., GigaDevice Semiconductor Inc. and Wingtech Technology Co. Many, like Novosense Microelectronics Co. and StarPower Semiconductor Ltd., have built significant capacity in so-called mature or lower-end nodes. The MIIT’s policy may soak up some of that capacity — at the expense of their foreign rivals.

The US and its European allies, meanwhile, have grown alarmed by China’s rush into older-generation chips. The Biden administration is mulling tariffs on those components in addition to other trade tools, but has said it is not considering restricting them using export controls.

While US rules introduced in 2022 slowed China’s development of advanced chipmaking capabilities, they left largely untouched the country’s ability to use techniques older than 14-nanometers. That has led Chinese firms to construct new plants faster than anywhere else in the world. They are forecast to build 26 fabs through 2026 that use 200-millimeter and 300-mm wafers, according to data from the trade group SEMI as of 2023. That compares with 16 fabs for the Americas.

**Source:** https://www.bloomberg.com/news/articles/2024-03-15/china-urges-byd-ev-makers-to-buy-chinese-chips-as-tensions-with-us-escalate"|0.87|64.0|0.0|64.0
t3_1bfeixc|1710510963.0|investing|PRM Stock - A stock for the future of Fire retardants|I would check out this stock based out of Luxembourg. I works with fire retardants. Although it may be a smaller market cap, it’s going to have complete control over that market because its the first company to be approved for Fluorine-Free retardants. As we move towards are more environmentally- clean area, companies will work towards these types of remedies. Up 40% in the past 3 months.|0.67|2.0|0.0|2.0
t3_1bfdj14|1710507992.0|investing|How to research pre-IPO investment opportunity?|While looking for a product for purchase, I came across a company offering investment opportunity. I am intrigued since the product is something I would buy and I like the idea of having ownership in the company. What steps should one take beyond reading the provided pitch deck?|0.57|2.0|0.0|2.0
t3_1bfddhh|1710507549.0|investing|Inherited IRA. Can you roll over non spouse Ira?|"Hello everyone,

My grand father died about a month ago. I recently received a call from an investment company saying my grand dad had an IRA and my father was a beneficiary but since my father is also passed, they said it goes to me. 

It’s not a giant amount or anything but I want to make the best move here. 

So my grand dad passed, left the Ira to my dad who passed, now they want to give it to me.

The company it is with keeps saying if I move it I’ll have to pay taxes. Can I not just open a fidelity ira and transfer it over ? My understanding is the account balance has to be $0 by a 10 year mark. So I’m assuming someone like fidelity has an Ira that when you inherit one you can just roll over even if you can’t roll it over into your existing Ira? 

My goal is, I want to get it away from the investment company it is with, sit it somewhere and worry about investing it later, not pay taxes on it right now or because I moved it. 

Thank you all. 
"|0.74|12.0|0.0|12.0
t3_1bfdcex|1710507455.0|investing|Should Australians get into the US markets?|Only just started looking into investing and struggling to jump in and buy a stock.  Friends said I should buy Australian only stocks because of tax reasons and internet says I should do both. What's your opinion, does anyone know what the tax implementations are for an Australian to use the US markets?|0.58|4.0|0.0|4.0
t3_1bf9jgb|1710493268.0|investing|Daily General Discussion and Advice Thread - March 15, 2024|"Have a general question?  Want to offer some commentary on markets?  Maybe you would just like to throw out a neat fact that doesn't warrant a self post?  Feel free to post here! 

If your question is ""I have $10,000, what do I do?"" or other ""advice for my personal situation"" questions, you should include relevant information, such as the following:

* How old are you? What country do you live in?  
* Are you employed/making income? How much?  
* What are your objectives with this money? (Buy a house? Retirement savings?)  
* What is your time horizon? Do you need this money next month? Next 20yrs?  
* What is your risk tolerance? (Do you mind risking it at blackjack or do you need to know its 100% safe?)  
* What are you current holdings? (Do you already have exposure to specific funds and sectors? Any other assets?)  
* Any big debts (include interest rate) or expenses?  
* And any other relevant financial information will be useful to give you a proper answer.  

Please consider consulting our FAQ first - https://www.reddit.com/r/investing/wiki/faq
And our [side bar](https://www.reddit.com/r/investing/about/sidebar) also has useful resources.  

If you are new to investing - please refer to Wiki - [Getting Started](https://www.reddit.com/r/investing/wiki/index/gettingstarted/)

The reading list in the wiki has a list of books ranging from light reading to advanced topics depending on your knowledge level. Link here - [Reading List](https://www.reddit.com/r/investing/wiki/readinglist)

Check the resources in the sidebar.

Be aware that these answers are just opinions of Redditors and should be used as a starting point for your research. You should strongly consider seeing a registered investment adviser if you need professional support before making any financial decisions!"|0.76|4.0|0.0|4.0
t3_1bf9hgj|1710493017.0|investing|Looking for options data/insights for Dax|"Hello, i'm looking for someone who can provide options data/insights for Dax/Ger40 especially gamma levels, gex, skew, IV and/or OI. 

I can find providers for US Stocks and Indicies but none for european markets.. i won't believe, that there aren't some resources where i can get this informations..

Hopefully there are any options traders in here, that work with this kind of edges and push their daily bias in trading..

Thanks!"|0.57|1.0|0.0|1.0
t3_1bf7lnn|1710484573.0|investing|What is the FINRA rule to cite if my brokerage is unavailable and I want to ask them for the difference in my eventual sell price?|My brokerage (etrade) had a minor outage recently when I was trying to put in a sell order, and when I eventually put in the sell the price had already dropped. I believe there's a FINRA? rule that says the brokerage is supposed to credit you the difference in those sell prices - what should I be citing if I reach out to their customer support? Is there anywhere with a boilerplate-type statement for this kind of inquiry? And/or should I be sending the request via FINRA instead of customer support?|0.3|0.0|0.0|0.0
t3_1bf4mux|1710473822.0|investing|For those holding cash, what stocks or other investments are you looking to pick up during the next market crash?|"I have some cash set aside specifically to invest when the market crashes and I’m interested to know if you do and if so what your ideas are for how you’ll invest it.

Right now on my list are VOO and VOOG for overall market exposure. For specific companies, I’m thinking about NVDA. I’m thinking about oil and natural gas ETFs as well.

What will you be looking to pick up in the next crash?"|0.63|37.0|0.0|37.0
t3_1bf17xf|1710463711.0|investing|Investor live-making / lifestyle?|"As an investor, how would you describe your lifestyle or activity? 

I mean, comparing it to a regular job with forty hours a week, normal stress, work-life balance, and guaranteed income. 

I'm kinda curious about how truly self-sufficient it is to invest for a living."|0.38|0.0|0.0|0.0
t3_1beyf4q|1710456262.0|investing|Old question lack of understanding|"Hi all, I have two questions. First why did crude oil futures,  /CL, fall on December 5th? I understand that EU banned the purchasing of Russian oil. But how does that affect the price of crude oil. Admittedly, I don't have the strongest grasp on oil markets. I just started doing a macro dive into them this week. 

Second question. Why when the US stopped purchasing Russian oil the oil futures fell again? The US was buying about 1% of Russia's total exports at the time.  

I looked at an economic calendar on March 8th there was some significant news for the US dollar which caused a rise in the dollar possibly causing oil to dip a bit. 

[The percentage that both countries had before and after the fact](https://www.iea.org/data-and-statistics/charts/average-russian-oil-exports-by-country-and-region-2021-2023)

[Euro stopping the purchase of Russian oil, a few days before G7 put a cap on Russia's oil](https://www.bbc.com/news/world-europe-63840412)

[US bans Russia's oil](https://www.whitehouse.gov/briefing-room/statements-releases/2022/03/08/fact-sheet-united-states-bans-imports-of-russian-oil-liquefied-natural-gas-and-coal/)

Clarification- Why does two OECD countries banning an OPEC country's oil make the OECDs' oil drop?

&amp;#x200B;

&amp;#x200B;"|0.33|0.0|0.0|0.0
t3_1bexc7x|1710453585.0|investing|Help me understand this ETF expense ratio, its listed at 11.17% (not a typo, 11.17%)|"Can someone explain the expense ratio of this ETF:  BZID (VanEck BDC Income ETF).

[https://www.vaneck.com/us/en/investments/bdc-income-etf-bizd/overview/](https://www.vaneck.com/us/en/investments/bdc-income-etf-bizd/overview/)

&amp;#x200B;

Someoneshowed me this and asked why the expense ratio is so high, and really do not understand.

On the website, the expense ratio is listed at 11.17%,   That sees insane to me.   Now I did find a PDF that says becuase this invests in BDC's (business development companies) ""and the expense ratios of the underlying funds has to be included in the fee structure"".

So would not the fees just wipe out any gains and dividends?

Maybe I am missing something but would love some insight,.

&amp;#x200B;

EDIT:    Think I found my answer.   The article is a little old. but I think the points it makes are still revelant:     

 [https://www.fa-mag.com/news/an-etf-with-an-expense-ratio-of-9-41-percent-42773.html?section=43&amp;page=2](https://www.fa-mag.com/news/an-etf-with-an-expense-ratio-of-9-41-percent-42773.html?section=43&amp;page=2)

&amp;#x200B;"|0.61|5.0|0.0|5.0
t3_1bevou7|1710449478.0|investing|ELI5 Nvidia's financials please|"When I check online, I see many posts, including in reddit regarding 2024 results. What I am having difficult to understand is that they are not mentioned as estimates or forecasts but rather like results. It is like 2024 x improved by y% compared to previous year or quarter. Also, AI has become big at least since the beginning of 2023 (chatGPT). How Nvidia wasn't able to beat their 2022 financials in 2023? Is it because they have got the orders in 2023 but will be paid in 2024? If these values are estimates, are there any risks that they will be way off, considering how big the growth estimates look?

  
I have no positions in Nvidia for favor or against it.  
"|0.39|0.0|0.0|0.0
t3_1betw61|1710445031.0|investing|Investing into Euro Buxl Future (with leverage)|"I had an appointment at Century Investment today, Dubai's oldest investment company.

I have a low 7-digit sum in equity that I want to invest into the S&amp;P 500 and into the Nasdaq.

They agreed to my plan with the addition that they recommended me to put 5-10% of my equity into the Euro-Buxl Future.

I am not familiar with bonds, but it was explained to me that this is a future of a German government bond. Since the interest rates of capital is sinking in Germany, the price of gov. bonds will increase and therefore the Buxl is a good investment. It was also recommended to me to use some leverage as German bonds are low in volatility. It was forecasted that the price of the Buxl will reach it's previous ATH of 176 in a matter of time and might reach 200-230 in value.

What are your thoughts on this?"|0.63|2.0|0.0|2.0
t3_1bete6s|1710443786.0|investing|Opinions on Moomoo Scam or Not|"Recently I learned that Moomoo is offering 8.1% on cash in their savings account. I'd like to play with around $10k with simple boring trades. Because I may want to take profits, I may want to liquidate portions of my folio, I'd also like to easily exit MM. 

I'd appreciate people's opinions. Because they are promoted by a Youtuber, I trust them less. Generally I worry that YT promoted tgings are either massively overpriced, or a scam or both.

If you have a better one I'd appreciate that. Plus one if the service does *not* use Plaid."|0.6|2.0|0.0|2.0
t3_1best92|1710442368.0|investing|Investing Children’s Money|I’ve found some older posts about this but want to get a fresher outlook. I’ve got two young kids, both under 6 years of age with about 8k in a savings each. I’d like to actually move it somewhere to grow. Whether for college or not I don’t expect them to touch it for about 15 years, but figure i should move it sooner than later to start letting it grow for them. I started reading about CDs, high yield savings, etc and feel a bit overwhelmed. Any insight would be great.|0.61|3.0|0.0|3.0
t3_1berxbk|1710440241.0|investing|Dividend Stock with payout ratio over 100%… Why?|"Right now I am in the middle of reallocating my dividend portfolio, so I am currently analysing a wide range of dividend stocks in regards to several factors, including the payout ratio. 

One part of my selection process is based on taking a look at the dividend yield and payout, looking for companies with a high yield but relatively low payout ratio. The assumption I am making is basically that it is a good sign if a company gives out a high yield but has a low payout ratio (compared to competitors), because it implies that even though dividends are high, the company still uses a good chunk of profits in order to grow. (Please let me know if you think this assumption is flawed). 

While researching I came across a few companies, e.g. Kinder Morgan (MO) or Energy Transfer (ET) that have payout ratios well above 100%. 

So my main question would be: why would a company pay out more dividends than actually making in terms of Earnings. To me that doesn’t seem logical or sustainable at all.

Would love to here y’all perspective on some plausible reasons behind that 

"|0.59|4.0|0.0|4.0
t3_1bepypp|1710435400.0|investing|Why is coinbase not in the S&amp;P500 index?|"Why hasnt Coinbase been added to the S&amp;P500. From what ive read the main criteria is having a market cap of over 8B, Being a US company and having a profitable trailing 4 quarters. It seems coinbase meets all of these criteria, yet it isn't listed. 

Why? "|0.19|0.0|0.0|0.0
t3_1bep5id|1710433372.0|investing|How do I learn to hedge properly? Let's take $S as an example|"I had a position in $S before the earnings report. For simplicity, let’s assume it constituted 100% of my portfolio. I expected that it could drop more than 10% due to the similar performance of other companies in the industry, but I was not certain. Instead of just selling it, I decided to try hedging for the first time.

So, I sold 5% of the shares at $28 and used the proceeds to buy put options with a strike price of $16, expiring in 3 months. Now, $S has dropped 15% and is currently priced at $24. Selling to close at the put ask price will cost an additional 1.5% of my portfolio (instead of getting 5% back, I will only get 3.5% back). The bid price is now 0%, and the volume is also 0, so selling at the bid price is problematic.

With my hedge, I’m down 16.5% instead of 15%. How could I have done better?

&amp;#x200B;

P.S. I appreciate all the responses. For those interested, here’s a brief summary:  
  
\- To hedge against a potential decline after an Earnings Report (ER), it’s advantageous to select a strike price close to the current price with a short expiration.  
\- It’s important to review both Delta and VOI.  
\- For educational resources, consider the ‘InTheMoney’ YouTube channel.  
\- For calculating options profit, you can use the online tool available at optionsprofitcalculator.com."|0.69|25.0|0.0|25.0
t3_1bemnu8|1710426964.0|investing|Is there any real point in holding stock for companies that are also in your index funds and ETFs?|New to all this and figuring it out. Schwab gave me a promotion of $20 each in apple, microsoft, nvidia, google, and amazon. I have money in SWPPX and SWTSX, and I’m planning on also getting an international index. Do i have any reason to keep the stock slices when I already have SWPPX? Is that redundant or is there any sort of advantage? I’ll probably keep nvidia and amazon at the least in case they keep seeing such good returns in the short term, but i’m not sure about holding apple, for example. I’m only 25 and trying to play the long game|0.65|8.0|0.0|8.0
t3_1belmws|1710424244.0|investing|Are Pharma Stocks Still A Post Covid Reasonable Investment |"During the run on pharma stocks during Covid, there was quite a strong value generation. While Moderna and Biontech went out of the pandemic as the big winner, stocks like CureVac or Novavax basically lost all value in the race for the first big vaccine supplies. Mrna is still interesting in terms of cancer treatment and these stocks are quite cheap. What do you think about investments in Pharma?
"|0.53|1.0|0.0|1.0
t3_1belbps|1710423342.0|investing|Combining stock/ETF &amp; Real Estate investing|"Hi everyone,  
My (M25) situation is the following, slightly complex, but, nevertheless, would really appreciate some advice.  
Employed and living at at home (Belgium) with a net monthly salary of c. EUR 3400. Barely have any expenses so I would be able to invest/take a loan with EUR 2500 quite easily. I inherited an apartment which i recently sold for EUR 270.000 and have another EUR 35.000 in savings.  
I have been pondering a lot about buying an apartment in my mother's home country (Romania), in Bucharest, more specifically. This is especially interesting, as when we won't be using the apartment I can rent it out (short-term rental) with an expected return of about 12-15% p.a.  
Here is the thing, I could either just buy an apartment with cash, which I am not very keen on doing or I could buy stocks/ETFs and use this as a collateral to purchase the apartment and repay the loan using (my salary/dividends/savings). I am, however, unsure this is a good idea given potential (heavy) market corrections that might occur and decrease the value of the stocks, despite the fact that, by default, there nature is to increase in value in the long-term.  
Is this a reasonable approach? and could I take a loan using stocks/ETFs as collateral from, let's say, DEGIRO, or Interactive brokers or should it be with an established bank.  
Happy to hear all your thoughts and even have a chat.  
Thanks a lot"|0.71|3.0|0.0|3.0
t3_1bel5sb|1710422866.0|investing|Why do companies sacrifice long term success for short term gain?|"With the main goal of many companies being increase stock value **NOW** I see many companies basically soiling their reputation for short term gains.

Two companies that stick out are Blizzard and Boeing.

Why would you sacrifice your main differentiator (quality) for a little money right now? Do shareholders not realize that sacrificing quality will hurt them in the long run?"|0.88|441.0|0.0|441.0
t3_1bek7u1|1710420009.0|investing|Better to max out 401k or put money into savings?|"I currently throw 8% of my salary into my employer match Roth 401k (that’s the % they’ll do their match up to). After all other expenses each month I typically have ~$1000 each month that I put into a 5% HYSA.

I’ve been told before that I should put most savings into a 401k rather than a savings account, but as a 24 year old that aspires to buy a home in the next 5-10 years I wonder if my savings is better kept in the short term.

Any thoughts would be very appreciated!

Edit: I also already put a fixed amount of my money into stocks as well"|0.77|29.0|0.0|29.0
t3_1bei2ct|1710412129.0|investing|Is there a way to set up an investing account that my niece can inherit when she turns 21?|"For example, I'm looking at Trading212, but it seems that they don't have the option. And I couldn't even name her as a beneficiary to inherit it even if I died, let alone when she hits a certain age.

Is a trust the only way? Or are there any online platforms that offer this?"|0.7|4.0|0.0|4.0
