id|created_utc|subreddit|title|selftext|upvote_ratio|ups|downs|score
t3_1bsi24h|1711911915.0|investing|Do I need to move my 401k|"About to leave a full time employee job, and work as a contractor for same company for purposes of working out of state. 

Have a decent chunk in company 401k

When I become a contractor, will I need to move my 401k? If moved, is that where I personally start making contributions when I get my contractor pay checks?

"|0.67|6.0|0.0|6.0
t3_1bsg7oi|1711907131.0|investing|Where to invest pension pot|"I have £30k in a old pension pot I no longer contribute to. Looking at investing it in something other than the default to try get a better return on it over the next 30+ years.

I'm looking at - 

Fid BlackRock US Equity
Fid BlackRock World (Ex-UK) Equity 
Fid BlackRock Japanese Equity
Fid BlackRock European Equity.

Would it be better to split the pension between 2 or 3 or leave it all in 1? What do you think the best split would be?

The pension is through Fidelity (UK) if anyone has any other tips/advice on who it should be invested through.

Thanks."|0.5|0.0|0.0|0.0
t3_1bsg1lx|1711906701.0|investing|New Grad ISO Advice Re: Paying Student Loans, Investing, or Saving|"I'm a recent grad looking for advice on how to maximize my salary long-term. If anyone can help me figure out this math so I can make a decision to maximize wealth long-term, I would really really appreciate it because I'm definitely feeling lost. Here are my stats:

**Salary:** $205,000

**Loans:** I have three student loans: (1) $20,500 at 4.3%, (2) $20,500 at 5.28%, and (3) $20,500 at 6.54%. So far, I only have one month of interest accumulated, and I do have the option to pay off each debt separately (so I can pay off the 6.54% loan first if I want to). 

**Investing:** I currently have an investment account with Vanguard that is returning about 12.8%

**Retirement:** I have a 401K with Charles Schwab that my new employer opened for me; so far, it's set at the default of 5% contribution, but I can max it to 10%.

**Savings:** I have about $22k in savings that I can use flexibly to pay off the student loans or use a different way.

**Other Expenses:** low

**Questions:** What would you all do? Should I make minimum payments on the student loans and instead contribute to my 401k or Investment account? Should I use the $22k I have saved to pay off the loan that's at 6.54%?

&amp;#x200B;"|0.22|0.0|0.0|0.0
t3_1bsfpzw|1711905836.0|investing|How do I get into the market safely?|"I am 43 (Family is spouse and two kids).

My current assists are:
85k in 401k in 2045 target retirement fund.
315k in cash.
55k in (physical) precious metals (Gold, gemstones)


We don’t have have anything else. (No house).

Income is 500k, but I do work in tech, so I would only assume 300k HHI over the long term.

How do I get into the market?

Given he current highs does the following dollar cost averaging work?

Emergency fund: 60k in HYSA
Liquidate gold and get $55k cash.

2024:
30% stock, 70% bond

2025:
45% stock, 55% bond 

2026:
60% stock, 40% bond

2027:
75% stock, 25% bond


Does this make sense?

Also in three years I would have added $600k (200k per year) through savings from my job.

EDIT1: I started from $0 in March 2022, after a bankruptcy that wiped out everything. In the days leading up to the bankruptcy I used my then 401k of $200k for living expenses.
"|0.21|0.0|0.0|0.0
t3_1bsdxxt|1711901201.0|investing|Robinhood for long term investors|"So I started with Vanguard and have been using them for 6 years. I'm a long term investor in Vanguard ETFs and index funds. I currently have about $250K split between a Roth IRA, IRA, and brokerage account. I plan to keep growing past $1M with this strategy.  

The current RH incentives have me looking at switching like so many others. I have about $100K in IRAs so that's a free $3K just for switching. Possibly more as it looks like they may be matching other deposits pretty soon. On top of this the ongoing incentives with RH gold should net me at least $250/yr.

I'm extremely happy with Vanguard and curious as to what I'd be losing by switching.

The Vanguard UI/reporting is perfect in my opinion. It very clearly shows investing performance. It shows total deposits, historical gains as a percentage/$ value on a per account basis with various time range options including a custom range option. Buying funds/ETFs is extremely simple as well. It's very much suited to my style of investing. Also I think Vanguard will still be around 30 years from now so I'll still have all that reporting from all the years of investing. This is valuable to me as someone that has goals and likes to track their investments.

My concerns with RH is that it seems to be more suited to short term investing and stock picking. I signed up for an account and the dashboard page is promoting individual stocks and cryptos. I see historical reporting for up to 1Y and ALL, but don't see a custom time range option. I can't access the 'Retirement' tab yet so I'm wondering how the reporting is for those accounts, and if I'll be able to have both an IRA and Roth IRA there.

So what I'm wondering is, has anyone in my type of position switched to RH and how has it gone?

Also, has anyone been with Robinhood for a long time and how is the reporting?

I would like to hear any opinions about RH for long term investors."|0.62|20.0|0.0|20.0
t3_1bsc8gz|1711896797.0|investing|Only $2k in an ira, should I just invest in an index fund?|Like the title says, I have just $2k in an ira (I also have a 401k but I don’t touch that). Should I just get 2k worth of index funds? Should I wait for the market to dip? I do plan on adding more money to the ira monthly or bimonthly depending on my finances. Thanks in advance.|0.63|12.0|0.0|12.0
t3_1bs74zc|1711880440.0|investing|Start investing (EU question)|"Hello people , I recently wanted to start investing I am a 27 year old that has some spare income at the moment working for Luxembourg.

My question is that Luxembourg has some good laws about investing but I don't know if I will be here for ever , let's say I want to invest 10k in SNP500 and after 20 years I am in another EU country , where would my tax be withheld? Does anyone know the answer or had an same experience?

For more clarification I am an European citizen from Greece , I work in Luxembourg as a cross border worker living in Germany. 

 Thanks everyone for their time."|0.5|0.0|0.0|0.0
t3_1bs62ce|1711875939.0|investing|"What do you think of dividend bull? I mean according to him the 4% rule for retiring is just a lame suggestion. 
"|"

He regularly covers high yielding dividend stocks as a means to retire early. And those stocks are usually between 5 or 6% and 11 to 13% iirc.

Is it possible with some dividend stocks, given their history, you can reasonably turn the 4% rule into a 6 or 7% rule? 

[dividend bull on YouTube ](https://youtube.com/@DividendBull?si=IyV57i8tmL0eyeKT)

Edit: btw he never said 4% rule is a lame suggestion. It's just his channel and the content he creates sort of imply it. "|0.29|0.0|0.0|0.0
t3_1bs5zzz|1711875671.0|investing|Daily General Discussion and Advice Thread - March 31, 2024|"Have a general question?  Want to offer some commentary on markets?  Maybe you would just like to throw out a neat fact that doesn't warrant a self post?  Feel free to post here! 

If your question is ""I have $10,000, what do I do?"" or other ""advice for my personal situation"" questions, you should include relevant information, such as the following:

* How old are you? What country do you live in?  
* Are you employed/making income? How much?  
* What are your objectives with this money? (Buy a house? Retirement savings?)  
* What is your time horizon? Do you need this money next month? Next 20yrs?  
* What is your risk tolerance? (Do you mind risking it at blackjack or do you need to know its 100% safe?)  
* What are you current holdings? (Do you already have exposure to specific funds and sectors? Any other assets?)  
* Any big debts (include interest rate) or expenses?  
* And any other relevant financial information will be useful to give you a proper answer.  

Please consider consulting our FAQ first - https://www.reddit.com/r/investing/wiki/faq
And our [side bar](https://www.reddit.com/r/investing/about/sidebar) also has useful resources.  

If you are new to investing - please refer to Wiki - [Getting Started](https://www.reddit.com/r/investing/wiki/index/gettingstarted/)

The reading list in the wiki has a list of books ranging from light reading to advanced topics depending on your knowledge level. Link here - [Reading List](https://www.reddit.com/r/investing/wiki/readinglist)

Check the resources in the sidebar.

Be aware that these answers are just opinions of Redditors and should be used as a starting point for your research. You should strongly consider seeing a registered investment adviser if you need professional support before making any financial decisions!"|0.72|3.0|0.0|3.0
t3_1bs26o1|1711860671.0|investing|Early 50s and not sure what the next step is|"I'm early 50s with about 100K in an annuity that I can restart accumulation on next month and 85k in an employer IRA that has gotten strong returns (I chose a ""growth and income"" option, 100%).  I have increased my percentage contribution to max out my catch-up contributions, and we've got about 60k cash buffer in an account with decent interest - we want that available in case of emergency. My husband's salary is our main income and he has about twice what I have saved. We own our own home; we won't be through our 30-year mortgage by retirement time, but we do have a very low interest rate from re-financing (think it's about 2.5%) and the house has increased significantly in value since we bought it. 

I'm not sure what else to do. I got lucky with a very modest investment in the Reddit IPO and now have about $1,000 in stocks - I sold some of the Reddit near peak and got a smattering of other stocks with good press, but I see this more as hobby-level stuff since I have little knowledge / experience. I feel like I should be doing more for retirement, but I'm not sure what. Would love to hear people's ideas. I'm hearing rumblings about the markets being overheated  - should I be adjusting my IRA distribution?"|0.55|2.0|0.0|2.0
t3_1bs1m2w|1711858691.0|investing|Financial advisor charging $375/hr?|"
I read Marketwatch where people ask a question. One question i often read is if its worth hiring a financial advisor at $300+/hr rate to come up with a full comprehensive financial plan. The article says it will take 20-40hrs and so you can expect to pay $5k+ for this plan. Sounds like a huge risk since not all financial planners are created equal. Has anyone done this and what do you really get for such a fee??"|0.79|96.0|0.0|96.0
t3_1bs13dm|1711857049.0|investing|ELI5: What is driving the price action in different treasury ETFs?|When I’m looking at treasury ETFs I’m noticing two trends: either the price action is extremely stable, literally a 45 degree line going upwards like with $BIL or $SGOV, or it’s moderately volatile like $HTRB or $FLGV. Why are some treasury ETFs devoid of volatility and some are full of it? |0.67|3.0|0.0|3.0
t3_1bryqpo|1711849829.0|investing|Frustrated with the amount of scammers in the financial space|"Hello,

It feels like almost everyone in the financial sector is a scammer sometimes. I know this isn't strictly true, but man the scammers are everywhere.

I was doing research on Sam Bankman Fried in the past week, and even when I searched for terms like ""financial scam"" or ""financial fraud"" or whatever the exact terms I used, I got results back from known scammers like Warrior Trading, who was going to warm me of frauds!

I clicked on a Youtube video from 60 minutes on Sam Bankman Fried, and I said to myself, 60 minutes won't scam me. And then Michael Lewis comes on and starts shilling for SBF. What the heck??

Didn't Michael Lewis write a book about toxic assets, which were then sold to investors as safe and AAA and then leveraged to the hilt, from various Wall St. banks and credit ratings agencies, in a combination of folly/stupidity and greed/fraud? The main question often was what percentage was stupidity and what percentage was scamming the public. That was The Big Short.

Here Lewis takes the side of someone who embezzled billions, freerolled the bezzle with an insane risky bet, recommended lots of shitcoins to unsuspecting investors, encouraged them to use even more risks with derivative bets on these shitcoins, and then outright stole what remained from investors to prop up his failing crypto hedge fund Alameda Research, which has lost billions in bad trades.

CNBC and Bloomberg are always hyping various scams. Elon Musk posts he will make a flying car at Tesla a few years ago, the stock jumps double digits on the news, and CNBC hypes it up. Then invite Michael Saylor to pump his crypto scheme even though he was a scammer way back from the dot com bubble. His firm had major accounting ""issues"" and somehow he is still not only CEO of his stupid company, but invited to pump it while he is dumping shares and has been selling consistently for the past six months or so.

I remember when CNBC was endlessly hyping Nikola and their electric truck and then a few weeks later that was revealed to be a scam and the truck towed up a hill and then a fancy promo is shot making it look like it's running on EV power and CNBC never apologized at all!

Don't get me started on WallStBets and RDDT or DJT. It's scams all the way down!"|0.57|4.0|0.0|4.0
t3_1brxtn2|1711847156.0|investing|Best way to save / invest|Hey fellas. 30 year old male here. I recently started to change my life around and learn to save etc. I currently have 12 K saved . I work 6 days a week and bring home 250/300$ a day cash. I recently opened a Robinhood acc and put 300 in Btc and a Roth IRA with only 100$ invested in it so far. What’s the best way you would ration out the money I bring home everyday so I can save/invest to my best ability . Any ideas or insights will help . Just want to save and live comfortably. |0.66|12.0|0.0|12.0
t3_1brxht1|1711846264.0|investing|Best broker for Australians |"Yeh pretty much just wondering if any Australians (or non Aussies) can let me know from their experience, what are the best broker to look at? 

Am looking at commsec as it’s easy to navigate and one of the big four banks here in Aus but the fees seem quite high.

Was considering eToro because I already have from the past an account setup with them but I hear a lot of stuff about them being a bit dodgy.

I’ve also been recommended interactive broker and CMC but both of which are based outside of Australia so I don’t know if that is something I want to avoid or not? 

And also Stake as I hear good things about them too.

Let me know if you guys can, thanks :) "|0.4|0.0|0.0|0.0
t3_1brvag5|1711840318.0|investing|Which Vanguard funds to Invest? |"Feeling a bit late to the retirement saving, but in a good position now to start investing in the future. Plan is to start maxing out my 401k with employer (employer includes a match) and start investing and possibly maxing out Roth IRA. I know I can max out for 2023 and 2024 but the bigger question is on which funds to invest in? Have been researching and keep coming across the same few names; VOO, VTI, VTSAX, VXUS. Trying to understand the different in investing in funds vs ETF, ETF seems to be the way to go to park the money and chill. Any suggestions? 
Background context: Early 30s, single, NY 
Thank you in advance! "|0.53|1.0|0.0|1.0
t3_1brv381|1711839773.0|investing|My parents are 60 and want to start investing |My parents are nearing 60 and want to start investing. They are about to downsize their house and have around 50-100k to invest with. Would putting it all in an index fund like S&amp;P 500 be smart? Or use the money to invest in real estate properties. I’m still very new when it comes to stock market investing so I’m not sure what is the best route. |0.84|212.0|0.0|212.0
t3_1bruo1z|1711838705.0|investing|Looking to build a 100k growth portfolio|"I have a $100k CD maturing at the end of next month and am planning on investing it all in a simple growth portfolio that I don't really need to actively watch. Here's what I'm thinking, open to feedback and suggestions. I am using Vanguard here just cause that's what I've always known but happy to use the Schwab equivalent or whatever. Also, I don't really care about dividends for this portfolio. Just maximum growth (within reason).

My assumptions about the market: I don't know if we're heading up or down, but I do think large caps are overpriced here, especially tech stocks like NVDA. I recently sold off lots of my tech stocks, aside from AAPL, with significant gains and put that into treasuries.  


* 50% VTI: US total market index
* 25% VXUS: global excluding US
* 25% VB: will give me a bit more weighting towards small caps, which I think will outperform large and mid caps  
"|0.5|0.0|0.0|0.0
t3_1bruaol|1711837743.0|investing|Keep this stock or move the money elsewhere?|"A couple of years ago, I inherited around $35k worth of DUK stock, which pays a decent dividend quarterly. I have it setup for that dividend payment to automatically reinvest into DUK to continue growing my number of shares, and subsequently my quarterly dividend payments. 

Should I:
A.) Keep doing what I’m doing?
B.) Redirect dividend payments to other investments?
C.) Liquidate my holding of DUK and move all $ elsewhere?

For reference, I’m 41yrs old, only debt I have is around $30k on my vehicle. I make $90k/yr. Very little 401k because my employer (who is fantastic to work for) quit making 401k contributions quite a while back. I own outright a piece of commercial property that I use for my own purposes which can generate additional income when I feel like it. I have $65k cash in the bank and a lot of land I’m selling that will net me around $100k after sale. After a lifetime of no financial guidance or advice (aside from “work hard and save your money”), I’m finally trying to create a path towards financial independence so that maybe I can retire someday. 

I’m curious to hear suggestions and reasonings behind suggestions so I can figure out what I want to do. Either way, I plan to start investing money on a bi-weekly or monthly schedule into index funds (ie VOO) and bonds. I also have a mid-cap mutual fund for my son that I contribute to annually on his birthday for him to have a nice nest egg when he hits 21yrs. 

What’s the smart move here?"|0.54|1.0|0.0|1.0
t3_1brrvq7|1711831568.0|investing|Sell my gold and buy stocks?|"Hey all, 

2 years ago when my wife (24f) and I (24m) got married, my dad gave us a wedding present of some gold/silver. Nothing insane but a generous gift. He said “it’s yours to do with as you see fit but I’d recommend holding it as a store of value and a fall back” 

Anyway, I have a decent job and we have plenty of cash for our lifestyle. I use the company 401(k) plus a Roth IRA. I have about $10k between the two. I’ve been thinking about selling the metals and putting it in a dividend stock/fund. Doing the calculations, I think it’d be smart to invest the money while gold is at an ath. 

What is your opinion on the idea overall and what do you think about gold/stock prices? 

Thanks! "|0.67|42.0|0.0|42.0
t3_1brrc6f|1711830178.0|investing|Looking to roll my automated Roth IRA to another broker. |"I started an automated Roth back in 2021 with JPMorgan, and have been placing 2500 a year to the account.  I’m up to about $7200. Chase is discontinuing their automated investing IRAs so I’m looking for a new broker to roll my Roth over to.

I do fixed monthly deposits from my savings account and I’m inquiring based on anyone’s experience which broker is user friendly and also has a well designed app.

My main goal is to have the Roth be automated so I can set it and forget it, but still have access to check on it from time to time.

My initial thought was Fidelity since my employer 401k is through Fidelity,  but wasn’t sure if there are better options.


"|0.64|4.0|0.0|4.0
t3_1brqabp|1711827459.0|investing|reddit stock Exchange: Is it worth investing or failed IPO? |"Does anyone know what proposal this IP has regarding improving its percentage on the stock market? 
Or if, on the contrary, they believe that it will be another failed IPO. I have been looking for information and proposals regarding how this is going to be commercialized but I have not seen anything concrete yet. 
If you have any idea of how it will be carried out or if there are proposals from the creator of Reddit or the workers about what they will do. 
If you can help me with information, interviews, news or your own comments, I would appreciate it. ;) "|0.27|0.0|0.0|0.0
t3_1brp5n1|1711824532.0|investing|Amazon's $150 Billion Data Center Bet: Preparing for AI Boom and Market Domination|"ARTICLE TLDR: Amazon is investing a whopping $150 billion over 15 years to build data centers, anticipating a surge in demand for AI and digital services. This move aims to cement Amazon's lead in cloud services and enhance customer satisfaction. Additionally, Amazon is allocating over $1 billion this year to Nvidia's new Blackwell AI data center, further underlining its commitment to staying ahead in the tech race. With previous significant expenditures and strategic acquisitions, Amazon signals a bullish stance on profitability and market dominance.  
  
SOURCE:  
  
https://nypost.com/2024/03/28/business/amazon-pours-150b-into-data-centers-to-handle-expected-ai-boom/"|0.8|31.0|0.0|31.0
t3_1brnlyf|1711820594.0|investing|VHYA, QQQM, iShares-iBonds, HSBC and BP. Need retirement planning advice|"Hi all. 
I am 38, setting aside USD 1,400 per month with annual ad-hoc contribution of USD 20,000. From 2025 onwards this will increase ro USD 2000 a month. 

My current portfolio is as under:

QQQM - 112 shares accumulated over 10 months at an average cost of 139. Current price is 182. 

VHYA - 204 shares, average cost 62.74, current price 70.82

**Total Equity ETF value : USD 34,800**

IBDT 2028 maturity - 5%+ YTM

IBTF - 2025 maturity - 5%+ YTM

**Total Bond ETF value : USD 22,000**

HSBC - 1,550 shares, average cost GBp 608, current price 619

BP - 1,270 shares, avg cost 478 GBp, current price 495.

**Total Stocks - USD 20,000**

I intend to use the monthly contributions, and dividends to accumulate BP shares till the investment reaches USD 20k atleast. 

I am doing this to build up an income generating portfolio by the time I reach 55. 

Happy to get any advice. 

HSBC I like because of the dividend yield, BP because of share-dividend options and am generally bullish on energy stocks till 2030"|0.5|0.0|0.0|0.0
t3_1brmu98|1711818610.0|investing|Brokerage Advice - Commsec or eToro? |"Simple question really..
I am looking to invest in ETFs and I was wondering if it would be more optimal for me to invest from Commsec or eToro?
As I noticed the Commsec fees seem really high.

Also on a side note,
The indices I am considering for investing are NDQ &amp; VAS.
1. I can not find VAS on eToro.
2. If I was to buy off eToro would their be any point of looking at NDQ or should I just go straight for the Nasdaq100 index? "|0.5|0.0|0.0|0.0
